{
  "$schema": "../../skills/run-test-plan/schemas/config.schema.json",
  "tracker": { "name": "GitHub", "issueUrl": "https://github.com/example/shop/issues/{key}" },
  "targets": { "app": "New checkout", "reference": "Legacy checkout" },
  "variants": {
    "device": { "label": "Device", "values": ["desktop", "mobile"] },
    "account": { "label": "Account", "values": ["guest", "member"] }
  },
  "capabilities": { "login": "my-app-login" }
}
